{
  "@id": "node_test_adapt_v1.0.0",
  "version": "1.0.0",
  "purpose_statement": "Test node for adaptation",
  "semantic_type": "scm_ontology:PlaceholderTestNode",
  "execution_logic": {
    "type": "Model_Ref",
    "reference": "model_dummy_v1.0.0",
    "parameters": {
      "threshold": 0.5,
      "rate": 10
    }
  },
  "outputs": [],
  "state_management": {
    "type": "Ephemeral"
  },
  "resilience_policy": [
    { "condition": "ExecutionError", "action": "Alert", "action_params": { "target_agent": "agent_monitor_v1" } }
  ],
  "observability": {
    "metrics": [],
    "logs": {
      "level": "Info",
      "content": "Standard"
    },
    "trace_propagation": true
  },
  "adaptation_strategy": {
    "trigger": "Performance_Degradation",
    "metric_ref": "metric_def_confidence_v1.0.0",
    "method": "Adjust_Parameters",
    "method_params": {}
  },
  "rationale": "Initial test node.",
  "author_agent_ref": "user_init",
  "creation_timestamp": "2024-08-01T12:00:00Z"
} 